reference,title,type,issn,part-of,url,reading-lists,eissn,doi
F359B313-C0C3-8DBF-958E-557C0F7B8F71,A New Tool for Epidemiology: The Usefulness of Dynamic-Agent Models in Understanding Place Effects on Health,article,0002-9262,American Journal of Epidemiology,http://readinglists.ucl.ac.uk/items/F359B313-C0C3-8DBF-958E-557C0F7B8F71.html,2F2A7E4B-B152-BF2B-F545-9CA96493F756:Optional,1476-6256,10.1093/aje/kwn118
F49089B3-1F78-44C9-E464-3E8EE0BC6043,Defining urban agglomerations to detect agglomeration economies,article,,,http://readinglists.ucl.ac.uk/items/F49089B3-1F78-44C9-E464-3E8EE0BC6043.html,2F2A7E4B-B152-BF2B-F545-9CA96493F756:Recommended,,
F5352D85-ED3C-9D86-6DFF-A97C736BB0EF,Smart city standards and publications | BSI Group,webpage,,,http://readinglists.ucl.ac.uk/items/F5352D85-ED3C-9D86-6DFF-A97C736BB0EF.html,AEDE270D-2CDE-A8DD-D05F-2D85E0F4FEA1:Optional,,
F5595621-31A2-1272-4605-B8576A4C0F05,Crowdfunding for the development of smart cities,article,00076813,Business Horizons,http://readinglists.ucl.ac.uk/items/F5595621-31A2-1272-4605-B8576A4C0F05.html,AEDE270D-2CDE-A8DD-D05F-2D85E0F4FEA1:Optional,,10.1016/j.bushor.2017.12.001
F56AFB96-36B9-CE84-A816-D3F1142846BE,50 Years of Data Science,article,1061-8600,Journal of Computational and Graphical Statistics,http://readinglists.ucl.ac.uk/items/F56AFB96-36B9-CE84-A816-D3F1142846BE.html,14F7EC69-3236-486A-5D3B-01B939E718AE:Recommended,1537-2715,10.1080/10618600.2017.1384734
F5D42C8D-4C1D-7F1C-39F0-5CA2CC4DC252,9 A time-geographic simulation model of individual activity programmes,chapter,,Timing space and spacing time: Vol.2: Human activity and time geography,http://readinglists.ucl.ac.uk/items/F5D42C8D-4C1D-7F1C-39F0-5CA2CC4DC252.html,2F2A7E4B-B152-BF2B-F545-9CA96493F756:Optional,,
F8B0E3CD-FBB3-673F-DEDB-A8003131BDD2,Smart cities Ranking of European medium-sized cities,document,,,http://readinglists.ucl.ac.uk/items/F8B0E3CD-FBB3-673F-DEDB-A8003131BDD2.html,AEDE270D-2CDE-A8DD-D05F-2D85E0F4FEA1:Optional,,
FA7A66A1-9DE9-B781-6EA5-7145D5AA85AC,Brief introductory guide to agent-based modeling and an illustration from urban health research,article,,Cadernos de Saúde Pública,http://readinglists.ucl.ac.uk/items/FA7A66A1-9DE9-B781-6EA5-7145D5AA85AC.html,2F2A7E4B-B152-BF2B-F545-9CA96493F756:Optional,0102-311X,10.1590/0102-311X00051615
FA92BE34-FDE4-8B5D-4D7F-B697AA486865,Equilibrium values and dynamics of attractiveness terms in production-constrained spatial-interaction models,article,0308-518X,Environment and Planning A,http://readinglists.ucl.ac.uk/items/FA92BE34-FDE4-8B5D-4D7F-B697AA486865.html,A6D7ED9B-ABF0-F08D-060D-726808C7AF2D,1472-3409,10.1068/a100371
FB786134-C1E1-35DD-5F0B-D2B274F13AE6,Comparative Urbanism: New Geographies and Cultures of Theorizing the Urban,article,,International Journal of Urban and Regional Research,http://readinglists.ucl.ac.uk/items/FB786134-C1E1-35DD-5F0B-D2B274F13AE6.html,2F2A7E4B-B152-BF2B-F545-9CA96493F756:Optional,,10.1111/1468-2427.12273
FD9A407F-E6B8-A609-0E5B-BFCBAAB72774,Critical GIS pedagogies beyond ‘Week 10: Ethics’,article,1365-8816,International Journal of Geographical Information Science,http://readinglists.ucl.ac.uk/items/FD9A407F-E6B8-A609-0E5B-BFCBAAB72774.html,14F7EC69-3236-486A-5D3B-01B939E718AE:Essential,1362-3087,10.1080/13658816.2017.1334892
FF406E5B-CA1A-8CDC-C167-4339CF3F21B6,Retheorizing Economic Geography: From the Quantitative Revolution to the “Cultural Turn”,article,0004-5608,Annals of the Association of American Geographers,http://readinglists.ucl.ac.uk/items/FF406E5B-CA1A-8CDC-C167-4339CF3F21B6.html,14F7EC69-3236-486A-5D3B-01B939E718AE:Optional,1467-8306,10.1111/0004-5608.00258
