reference,title,type,issn,part-of,url,reading-lists,eissn,doi
A2E846DF-6009-4B12-E9F8-9BF8866F40EF,"Constructing cities, deconstructing scaling laws",article,1742-5689,Journal of The Royal Society Interface,http://readinglists.ucl.ac.uk/items/A2E846DF-6009-4B12-E9F8-9BF8866F40EF.html,2F2A7E4B-B152-BF2B-F545-9CA96493F756:Recommended,1742-5662,10.1098/rsif.2014.0745
A3271EF5-B2AB-5FE4-9D01-3B13760BE501,THE QUANTITATIVE REVOLUTION AND THEORETICAL GEOGRAPHY,article,0008-3658,The Canadian Geographer/Le Géographe canadien,http://readinglists.ucl.ac.uk/items/A3271EF5-B2AB-5FE4-9D01-3B13760BE501.html,14F7EC69-3236-486A-5D3B-01B939E718AE:Essential,1541-0064,10.1111/j.1541-0064.1963.tb00796.x
A37D85E3-6567-22CF-F3B4-BA46EF50054A,Chris Brunsdon's RPubs Website,webpage,,,http://readinglists.ucl.ac.uk/items/A37D85E3-6567-22CF-F3B4-BA46EF50054A.html,F66757BF-E61E-B8BB-95A0-1F25B51E3818,,
A3D94270-CDCC-88AB-1C26-BDB4F698D67D,Charles Booth's London,website,,,http://readinglists.ucl.ac.uk/items/A3D94270-CDCC-88AB-1C26-BDB4F698D67D.html,2F2A7E4B-B152-BF2B-F545-9CA96493F756:Optional,,
A591C806-2DE4-21BF-CD8A-3FD09C3997C1,Gibrat's Law for (All) Cities,article,0002-8282,American Economic Review,http://readinglists.ucl.ac.uk/items/A591C806-2DE4-21BF-CD8A-3FD09C3997C1.html,2F2A7E4B-B152-BF2B-F545-9CA96493F756:Optional,,10.1257/0002828043052303
A67F40B1-CE63-FC09-7D15-A182013361D5,Focus Group on Smart Sustainable Cities,webpage,,,http://readinglists.ucl.ac.uk/items/A67F40B1-CE63-FC09-7D15-A182013361D5.html,AEDE270D-2CDE-A8DD-D05F-2D85E0F4FEA1:Optional,,
A75D35C8-FADB-83F0-175D-8EF358777EA5,In: Proceedings of the First ACM International Workshop on the Engineering of Reliable,journal,,,http://readinglists.ucl.ac.uk/items/A75D35C8-FADB-83F0-175D-8EF358777EA5.html,AEDE270D-2CDE-A8DD-D05F-2D85E0F4FEA1:Optional,,
A9AE0CAA-72FB-D1B5-DBF3-D144852FADB2,"Hidden Cities, Unmasking and Overcoming Health Inequities in Urban Settings",document,,,http://readinglists.ucl.ac.uk/items/A9AE0CAA-72FB-D1B5-DBF3-D144852FADB2.html,2F2A7E4B-B152-BF2B-F545-9CA96493F756:Optional,,
A9EAB1CE-5F67-B5E2-00E8-698307615E3A,Mission Control: A History of the Urban Dashboard,article,,Places Journal,http://readinglists.ucl.ac.uk/items/A9EAB1CE-5F67-B5E2-00E8-698307615E3A.html,14F7EC69-3236-486A-5D3B-01B939E718AE:Essential,21647798,10.22269/150309
AAC61812-E695-836D-E6BB-F911772140D8,"Smart Cities: Definitions, Dimensions, Performance, and Initiatives",article,1063-0732,Journal of Urban Technology,http://readinglists.ucl.ac.uk/items/AAC61812-E695-836D-E6BB-F911772140D8.html,AEDE270D-2CDE-A8DD-D05F-2D85E0F4FEA1:Recommended,1466-1853,10.1080/10630732.2014.942092
AC709161-AF6C-CC24-0C16-A21B0253D64F,"The dimensions of global urban expansion: Estimates and projections for all countries, 2000–2050",article,03059006,Progress in Planning,http://readinglists.ucl.ac.uk/items/AC709161-AF6C-CC24-0C16-A21B0253D64F.html,2F2A7E4B-B152-BF2B-F545-9CA96493F756:Recommended,,10.1016/j.progress.2011.04.001
ACE9524D-0FD5-BC63-EAE8-E21F1926373E,2018 reform of EU data protection rules | European Commission,webpage,,,http://readinglists.ucl.ac.uk/items/ACE9524D-0FD5-BC63-EAE8-E21F1926373E.html,AEDE270D-2CDE-A8DD-D05F-2D85E0F4FEA1:Optional,,
AD0367A1-7BE1-91C6-FA26-EA6D72E717D9,Local Spatial Autocorrelation Statistics: Distributional Issues and an Application,article,,Geographical Analysis,http://readinglists.ucl.ac.uk/items/AD0367A1-7BE1-91C6-FA26-EA6D72E717D9.html,F66757BF-E61E-B8BB-95A0-1F25B51E3818,,10.1111/j.1538-4632.1995.tb00912.x
AE7CF33D-1302-1C90-2C11-99576C30B2A1,Chapter 4 - Building Blocks of Spatial Analysis,chapter,,Geospatial Analysis - spatial and GIS analysis techniques and GIS software,http://readinglists.ucl.ac.uk/items/AE7CF33D-1302-1C90-2C11-99576C30B2A1.html,F66757BF-E61E-B8BB-95A0-1F25B51E3818,,
AE9A241B-8889-9ED5-29F3-04CBF51AF17F,"Mobilizing policy: Models, methods, and mutations",article,00167185,Geoforum,http://readinglists.ucl.ac.uk/items/AE9A241B-8889-9ED5-29F3-04CBF51AF17F.html,AEDE270D-2CDE-A8DD-D05F-2D85E0F4FEA1:Optional,,10.1016/j.geoforum.2010.01.002
AEB2513E-B6AD-B370-A57D-1892281A8CD6,Power-Law Distributions in Empirical Data,article,0036-1445,SIAM Review,http://readinglists.ucl.ac.uk/items/AEB2513E-B6AD-B370-A57D-1892281A8CD6.html,2F2A7E4B-B152-BF2B-F545-9CA96493F756:Optional,1095-7200,10.1137/070710111
AEC3933C-F787-20D8-4AB1-266C81E5E2B9,Hackathons as Co-optation Ritual: Socializing Workers and Institutionalizing Innovation in the “New” Economy,chapter,,Precarious Work,http://readinglists.ucl.ac.uk/items/AEC3933C-F787-20D8-4AB1-266C81E5E2B9.html,AEDE270D-2CDE-A8DD-D05F-2D85E0F4FEA1:Optional,,10.1108/S0277-283320170000031005
AEEEBF6B-4768-96C2-4E3A-CCA1FAC0827E,"Social organization, stress, and health",chapter,,Social Determinants of Health,http://readinglists.ucl.ac.uk/items/AEEEBF6B-4768-96C2-4E3A-CCA1FAC0827E.html,2F2A7E4B-B152-BF2B-F545-9CA96493F756:Optional,,10.1093/acprof:oso/9780198565895.003.02
AF28D9C3-6A5E-3291-6D36-0F7E300BDC80,Robust statistical tests of Dragon-Kings beyond power law distributions,article,1951-6355,The European Physical Journal Special Topics,http://readinglists.ucl.ac.uk/items/AF28D9C3-6A5E-3291-6D36-0F7E300BDC80.html,2F2A7E4B-B152-BF2B-F545-9CA96493F756:Optional,1951-6401,10.1140/epjst/e2012-01564-8
AF4AF9D8-FFF2-40D0-54CA-7B640D8FF9C0,Thinking Geographically: Globalizing Capitalism and Beyond,article,0004-5608,Annals of the Association of American Geographers,http://readinglists.ucl.ac.uk/items/AF4AF9D8-FFF2-40D0-54CA-7B640D8FF9C0.html,2F2A7E4B-B152-BF2B-F545-9CA96493F756:Essential,1467-8306,10.1080/00045608.2015.1064513
AF5D44CA-E8AD-D005-0CAF-11206CE34BE4,Sustainable Connected Cities: Vision and Blueprint towards Managing IT for City Prosperity and Sustainability,chapter,,Design Science: Perspectives from Europe,http://readinglists.ucl.ac.uk/items/AF5D44CA-E8AD-D005-0CAF-11206CE34BE4.html,AEDE270D-2CDE-A8DD-D05F-2D85E0F4FEA1:Optional,,10.1007/978-3-319-13936-4_8
AF9765C5-6C7C-56AF-0EA3-B4DA51CC9786,The real-time city? Big data and smart urbanism,article,0343-2521,GeoJournal,http://readinglists.ucl.ac.uk/items/AF9765C5-6C7C-56AF-0EA3-B4DA51CC9786.html,AEDE270D-2CDE-A8DD-D05F-2D85E0F4FEA1:Recommended,1572-9893,10.1007/s10708-013-9516-8
B19D238D-684A-57A4-6112-C6B84C085B23,Exploring the Appropriateness of Different Immersive Environments in the Context of an Innovation Process for Smart Cities,article,,,http://readinglists.ucl.ac.uk/items/B19D238D-684A-57A4-6112-C6B84C085B23.html,AEDE270D-2CDE-A8DD-D05F-2D85E0F4FEA1:Optional,,
B303A375-B53A-4284-EC3C-34D1C3841411,Raster analysis in R,webpage,,,http://readinglists.ucl.ac.uk/items/B303A375-B53A-4284-EC3C-34D1C3841411.html,F66757BF-E61E-B8BB-95A0-1F25B51E3818,,
B3B39D39-E4C8-034B-C6B5-F65FEDB7B918,On the First Law of Geography: A Reply,article,0004-5608,Annals of the Association of American Geographers,http://readinglists.ucl.ac.uk/items/B3B39D39-E4C8-034B-C6B5-F65FEDB7B918.html,F66757BF-E61E-B8BB-95A0-1F25B51E3818,1467-8306,10.1111/j.1467-8306.2004.09402009.x
B5D29CFB-E023-7A67-1B78-66AD54D2BA05,Living labs and vacancy in the neoliberal city,article,738793,Cities,http://readinglists.ucl.ac.uk/items/B5D29CFB-E023-7A67-1B78-66AD54D2BA05.html,AEDE270D-2CDE-A8DD-D05F-2D85E0F4FEA1:Optional,,10.1016/j.cities.2017.10.008
B7055F3C-C34D-A527-233A-E87D8EF03692,A Ladder Of Citizen Participation,article,0002-8991,Journal of the American Institute of Planners,http://readinglists.ucl.ac.uk/items/B7055F3C-C34D-A527-233A-E87D8EF03692.html,AEDE270D-2CDE-A8DD-D05F-2D85E0F4FEA1:Optional,,10.1080/01944366908977225
B7171510-7BC0-E7FC-3E7A-6C57D5EA97B3,"Chapter 5: Unicorns Janitors, Ninjas, Wizards, and Rock Stars",chapter,,Data Feminism,http://readinglists.ucl.ac.uk/items/B7171510-7BC0-E7FC-3E7A-6C57D5EA97B3.html,14F7EC69-3236-486A-5D3B-01B939E718AE:Essential,,
B76A5718-5424-98E4-6DDB-C3339E35E18F,ArcGIS Help 10.1 - How Spatial Autocorrelation (Global Moran&#039;s I) works,webpage,,,http://readinglists.ucl.ac.uk/items/B76A5718-5424-98E4-6DDB-C3339E35E18F.html,F66757BF-E61E-B8BB-95A0-1F25B51E3818,,
B98DE59F-8659-C4BE-7A24-59878DFEDBB4,Reinventing the suburbs: Old myths and new realities,article,03059006,Progress in Planning,http://readinglists.ucl.ac.uk/items/B98DE59F-8659-C4BE-7A24-59878DFEDBB4.html,2F2A7E4B-B152-BF2B-F545-9CA96493F756:Optional,,10.1016/0305-9006(96)88868-4
BA45123F-3532-7640-C6BD-A9160DEF7499,7 Survival and Arena,chapter,,Timing space and spacing time: Vol.2: Human activity and time geography,http://readinglists.ucl.ac.uk/items/BA45123F-3532-7640-C6BD-A9160DEF7499.html,2F2A7E4B-B152-BF2B-F545-9CA96493F756:Optional,,
BDEDFF21-2EF8-2703-9C81-83D1C7471728,The cultural contradictions of the creative city,article,18779166,"City, Culture and Society",http://readinglists.ucl.ac.uk/items/BDEDFF21-2EF8-2703-9C81-83D1C7471728.html,2F2A7E4B-B152-BF2B-F545-9CA96493F756:Optional,,10.1016/j.ccs.2011.08.002
BE330CC2-F140-51F1-2EA1-3E12C109A49D,Scaling and Hierarchy in Urban Economies,article,,,http://readinglists.ucl.ac.uk/items/BE330CC2-F140-51F1-2EA1-3E12C109A49D.html,2F2A7E4B-B152-BF2B-F545-9CA96493F756:Optional,,
BEBD651E-FC96-B3ED-C47A-68807159F2E9,"R for Data Science, chapter 21 and 23",website,,,http://readinglists.ucl.ac.uk/items/BEBD651E-FC96-B3ED-C47A-68807159F2E9.html,F66757BF-E61E-B8BB-95A0-1F25B51E3818,,
BFFD249C-CF97-6A62-405C-1C905219F6BD,Introduction to Python Programming: Python Training - Microsoft Virtual Academy,webpage,,,http://readinglists.ucl.ac.uk/items/BFFD249C-CF97-6A62-405C-1C905219F6BD.html,14F7EC69-3236-486A-5D3B-01B939E718AE:Optional,,
C2501F7E-4CBF-AD34-9746-6C069ADDED1A,"Beginning Statistics - chapter 2, descriptive statistics",chapter,,,http://readinglists.ucl.ac.uk/items/C2501F7E-4CBF-AD34-9746-6C069ADDED1A.html,F66757BF-E61E-B8BB-95A0-1F25B51E3818,,
C2EB8204-9411-0493-8D4E-A1E926522311,The Factorial Ecology of Calcutta,article,0002-9602,American Journal of Sociology,http://readinglists.ucl.ac.uk/items/C2EB8204-9411-0493-8D4E-A1E926522311.html,2F2A7E4B-B152-BF2B-F545-9CA96493F756:Optional,1537-5390,10.1086/224681
C4BBE991-C9C1-20E7-1A72-54691E16AE13,Analysing Spatial Point Patterns in R - Workshop,document,,,http://readinglists.ucl.ac.uk/items/C4BBE991-C9C1-20E7-1A72-54691E16AE13.html,F66757BF-E61E-B8BB-95A0-1F25B51E3818,,
C52EE8F3-21E8-8361-7C88-196B334D3E6D,"Who's right, Marshall or Jacobs? The localization versus urbanization debate",article,00487333,Research Policy,http://readinglists.ucl.ac.uk/items/C52EE8F3-21E8-8361-7C88-196B334D3E6D.html,AEDE270D-2CDE-A8DD-D05F-2D85E0F4FEA1:Recommended,,10.1016/j.respol.2008.11.010
C539B2F4-1451-1111-ACB6-C095603FA1E8,The New Urban Agenda - Habitat III,document,,,http://readinglists.ucl.ac.uk/items/C539B2F4-1451-1111-ACB6-C095603FA1E8.html,2F2A7E4B-B152-BF2B-F545-9CA96493F756:Optional,,
C56185E5-7712-923A-C6EA-578883794656,"New urban utopias of postcolonial India: ‘Entrepreneurial urbanization’ in Dholera smart city, Gujarat",article,,,http://readinglists.ucl.ac.uk/items/C56185E5-7712-923A-C6EA-578883794656.html,AEDE270D-2CDE-A8DD-D05F-2D85E0F4FEA1:Optional,,
C615C415-47C0-255F-83CF-F881A952FC54,"Entrepreneurial Urbanism, Policy Tourism, and the Making Mobile of Policies",chapter,,The New Blackwell Companion to the City,http://readinglists.ucl.ac.uk/items/C615C415-47C0-255F-83CF-F881A952FC54.html,2F2A7E4B-B152-BF2B-F545-9CA96493F756:Optional,,10.1002/9781444395105.ch63
C9393F47-5A03-02DA-0DE6-DA558C11D296,Evaluation and Planning: Inseparable Concepts,article,,The Town Planning Review,http://readinglists.ucl.ac.uk/items/C9393F47-5A03-02DA-0DE6-DA558C11D296.html,AEDE270D-2CDE-A8DD-D05F-2D85E0F4FEA1,,
C9A3FDA1-71AB-5225-1C4C-938702D6D674,Class Places and Place Classes: Geodemographics and the spatialization of class,article,1369-118X,"Information, Communication &amp; Society",http://readinglists.ucl.ac.uk/items/C9A3FDA1-71AB-5225-1C4C-938702D6D674.html,2F2A7E4B-B152-BF2B-F545-9CA96493F756:Optional,1468-4462,10.1080/13691180701751122
CA7E9043-FA60-50F4-8DC1-9EA206C16840,SSCC-CG final report,document,,,http://readinglists.ucl.ac.uk/items/CA7E9043-FA60-50F4-8DC1-9EA206C16840.html,AEDE270D-2CDE-A8DD-D05F-2D85E0F4FEA1:Optional,,
CAEFCB9A-40E4-0A94-9246-8CD7E192B5BE,WHAT ABOUT PEOPLE IN REGIONAL SCIENCE?,article,,Papers in Regional Science,http://readinglists.ucl.ac.uk/items/CAEFCB9A-40E4-0A94-9246-8CD7E192B5BE.html,2F2A7E4B-B152-BF2B-F545-9CA96493F756:Essential,,10.1111/j.1435-5597.1970.tb01464.x
CB0E9E0E-AF51-B0C5-20F4-10C68BE7ED1D,First Law of Geography,chapter,,International Encyclopedia of Human Geography,http://readinglists.ucl.ac.uk/items/CB0E9E0E-AF51-B0C5-20F4-10C68BE7ED1D.html,F66757BF-E61E-B8BB-95A0-1F25B51E3818,,
CC931F2C-ECFF-C915-F5D2-229B2A36F573,Global firms and smart technologies: IBM and the reduction of cities,article,,Transactions of the Institute of British Geographers,http://readinglists.ucl.ac.uk/items/CC931F2C-ECFF-C915-F5D2-229B2A36F573.html,AEDE270D-2CDE-A8DD-D05F-2D85E0F4FEA1:Optional,,10.1111/tran.12098
CC980CB8-B8D8-850B-0053-8C4FA1882BFC,What Makes a Social Class? On The Theoretical and Practical Existence Of Groups,article,00675830,Berkeley Journal of Sociology,http://readinglists.ucl.ac.uk/items/CC980CB8-B8D8-850B-0053-8C4FA1882BFC.html,2F2A7E4B-B152-BF2B-F545-9CA96493F756:Optional,,
CCD3D75D-07CD-4E8D-A4E1-F3F30F1C4FEA,Feminist Critiques of GIS,article,,Geographic Information Science &amp; Technology Body of Knowledge,http://readinglists.ucl.ac.uk/items/CCD3D75D-07CD-4E8D-A4E1-F3F30F1C4FEA.html,14F7EC69-3236-486A-5D3B-01B939E718AE:Optional,25772848,10.22224/gistbok/2019.2.12
CD337F7B-B074-5FAE-E5D5-6AF36BD98306,Spatial data science raster package,webpage,,,http://readinglists.ucl.ac.uk/items/CD337F7B-B074-5FAE-E5D5-6AF36BD98306.html,F66757BF-E61E-B8BB-95A0-1F25B51E3818,,
CD48160F-9827-11C1-C5F8-7219E769A75A,Recommendations for implementing the strategic initiative INDUSTRIE 4.0,document,,,http://readinglists.ucl.ac.uk/items/CD48160F-9827-11C1-C5F8-7219E769A75A.html,AEDE270D-2CDE-A8DD-D05F-2D85E0F4FEA1:Optional,,
CE1E6E03-E700-97DD-0D3B-443DC0FE70BD,Smart Citizens: Exploring the Tools of the Urban Bottom-Up Movement,article,0925-9724,Computer Supported Cooperative Work (CSCW),http://readinglists.ucl.ac.uk/items/CE1E6E03-E700-97DD-0D3B-443DC0FE70BD.html,AEDE270D-2CDE-A8DD-D05F-2D85E0F4FEA1:Optional,1573-7551,10.1007/s10606-016-9249-6
CEC03F98-FA18-6C14-6AD0-A733C0D94702,Geo-Refer > Online Geographical Referencing Resources for Social Scientists -- Resources,webpage,,,http://readinglists.ucl.ac.uk/items/CEC03F98-FA18-6C14-6AD0-A733C0D94702.html,F66757BF-E61E-B8BB-95A0-1F25B51E3818,,
CF0A22AE-13E1-ABE4-5198-B7CECDE8EA82,International Open Data Charter,webpage,,,http://readinglists.ucl.ac.uk/items/CF0A22AE-13E1-ABE4-5198-B7CECDE8EA82.html,AEDE270D-2CDE-A8DD-D05F-2D85E0F4FEA1:Optional,,
CFCA8DE6-5BD9-CA17-F159-0F31955CF057,Big Data and the City,article,02637960,Built Environment,http://readinglists.ucl.ac.uk/items/CFCA8DE6-5BD9-CA17-F159-0F31955CF057.html,AEDE270D-2CDE-A8DD-D05F-2D85E0F4FEA1:Optional,,10.2148/benv.42.3.321
D01B42D2-115F-E1FE-EFC2-8A3D04591E1B,"Spatial Clustering, Detection and Analysis of",chapter,,International Encyclopedia of Human Geography,http://readinglists.ucl.ac.uk/items/D01B42D2-115F-E1FE-EFC2-8A3D04591E1B.html,F66757BF-E61E-B8BB-95A0-1F25B51E3818,,
D0AE0D1A-7375-1284-47F8-99FEE3CF26B1,Provincializing Critical Urban Theory: Extending the Ecosystem of Possibilities,article,,International Journal of Urban and Regional Research,http://readinglists.ucl.ac.uk/items/D0AE0D1A-7375-1284-47F8-99FEE3CF26B1.html,2F2A7E4B-B152-BF2B-F545-9CA96493F756:Optional,,10.1111/1468-2427.12277
D143D841-6FB8-4D9E-8945-F35E190BF430,A Theoretical Foundation for the Concept of Differential Urbanization,article,0160-0176,International Regional Science Review,http://readinglists.ucl.ac.uk/items/D143D841-6FB8-4D9E-8945-F35E190BF430.html,2F2A7E4B-B152-BF2B-F545-9CA96493F756:Recommended,,10.1177/016001769301500202
D272DC27-31E3-58AB-024E-02096A69FA75,Lessons Learned from Testing the Differential Urbanisation Model,article,0040-747X,Tijdschrift voor Economische en Sociale Geografie,http://readinglists.ucl.ac.uk/items/D272DC27-31E3-58AB-024E-02096A69FA75.html,2F2A7E4B-B152-BF2B-F545-9CA96493F756:Recommended,1467-9663,10.1111/1467-9663.00242
D428A118-EAC8-A1A9-27BF-020A9DA89570,The spaces in between: Mobile policy and the topographies and topologies of the technocracy,article,0263-7758,Environment and Planning D: Society and Space,http://readinglists.ucl.ac.uk/items/D428A118-EAC8-A1A9-27BF-020A9DA89570.html,AEDE270D-2CDE-A8DD-D05F-2D85E0F4FEA1:Recommended,1472-3433,10.1177/0263775815618401
D7A613ED-172B-BE5B-DBA7-558453A8476F,The Changing Pattern of Ethnic Segregation in Great Britain,article,,,http://readinglists.ucl.ac.uk/items/D7A613ED-172B-BE5B-DBA7-558453A8476F.html,2F2A7E4B-B152-BF2B-F545-9CA96493F756:Optional,,
DAB0F702-CA39-032E-52FC-5C35DDCB9A73,Crowd-sourcing the smart city: Using big geosocial media metrics in urban governance,article,2053-9517,Big Data &amp; Society,http://readinglists.ucl.ac.uk/items/DAB0F702-CA39-032E-52FC-5C35DDCB9A73.html,AEDE270D-2CDE-A8DD-D05F-2D85E0F4FEA1:Optional,2053-9517,10.1177/2053951717694384
DAC191BA-2FC4-FD67-D90F-DEA6FCB5D5B1,Kernels and Density Estimation,article,,Geographic Information Science &amp; Technology Body of Knowledge,http://readinglists.ucl.ac.uk/items/DAC191BA-2FC4-FD67-D90F-DEA6FCB5D5B1.html,14F7EC69-3236-486A-5D3B-01B939E718AE:Optional,25772848,10.22224/gistbok/2020.1.12
DC28510A-CA91-6C19-C8CE-7CC09BC4447B,"Ethnographic Evidence, Heterogeneity, and Neighbourhood Effects After Moving to Opportunity",chapter,,Neighbourhood effects research: new perspectives,http://readinglists.ucl.ac.uk/items/DC28510A-CA91-6C19-C8CE-7CC09BC4447B.html,2F2A7E4B-B152-BF2B-F545-9CA96493F756:Recommended,,
DC356AFF-C9CD-FE1F-CF84-437E5143058C,Unpacking European Living Labs: Analysing Innovation’s Social Dimensions,article,1802-4866,Central European Journal of Public Policy,http://readinglists.ucl.ac.uk/items/DC356AFF-C9CD-FE1F-CF84-437E5143058C.html,AEDE270D-2CDE-A8DD-D05F-2D85E0F4FEA1:Optional,,
DDF69904-7EDF-11A6-3DA7-E83D94A04021,Do Physicists Have Geography Envy? And What Can Geographers Learn from It?,article,0004-5608,Annals of the Association of American Geographers,http://readinglists.ucl.ac.uk/items/DDF69904-7EDF-11A6-3DA7-E83D94A04021.html,14F7EC69-3236-486A-5D3B-01B939E718AE:Essential,1467-8306,10.1080/00045608.2015.1039105
DFA75016-9727-6F5B-1278-685ECCC8EA64,Kernels and Density Estimation,article,,Geographic Information Science &amp; Technology Body of Knowledge,http://readinglists.ucl.ac.uk/items/DFA75016-9727-6F5B-1278-685ECCC8EA64.html,14F7EC69-3236-486A-5D3B-01B939E718AE:Optional,25772848,10.22224/gistbok/2020.1.12
DFE01FF9-F300-9231-E01C-19BF88EA9AE0,The limits of crisis data: analytical and ethical challenges of using social and mobile data to understand disasters,article,0343-2521,GeoJournal,http://readinglists.ucl.ac.uk/items/DFE01FF9-F300-9231-E01C-19BF88EA9AE0.html,14F7EC69-3236-486A-5D3B-01B939E718AE:Optional,1572-9893,10.1007/s10708-014-9597-z
DFE4DE56-23F5-6015-1789-5E1AD92B343C,Cities or urbanization?,article,1360-4813,City,http://readinglists.ucl.ac.uk/items/DFE4DE56-23F5-6015-1789-5E1AD92B343C.html,2F2A7E4B-B152-BF2B-F545-9CA96493F756:Optional,1470-3629,10.1080/13604819608900022
E03130AB-B36D-5079-827F-821F9C49E843,What Problem? Spatial Autocorrelation and Geographic Information Science,article,,Geographical Analysis,http://readinglists.ucl.ac.uk/items/E03130AB-B36D-5079-827F-821F9C49E843.html,F66757BF-E61E-B8BB-95A0-1F25B51E3818,,10.1111/j.1538-4632.2009.00769.x
E06933D6-DE26-9B5C-2B32-DA3F002544D9,Triangulation of the the Triple Helix: A conceptual Framework,document,,,http://readinglists.ucl.ac.uk/items/E06933D6-DE26-9B5C-2B32-DA3F002544D9.html,AEDE270D-2CDE-A8DD-D05F-2D85E0F4FEA1:Optional,,
E300C989-FB59-99C6-97B8-13AB98C230E5,"Geodemographics, Software and Class",article,0038-0385,Sociology,http://readinglists.ucl.ac.uk/items/E300C989-FB59-99C6-97B8-13AB98C230E5.html,AEDE270D-2CDE-A8DD-D05F-2D85E0F4FEA1:Optional,1469-8684,10.1177/0038038506067507
E37D670B-551F-9D10-691B-A6F49BA52901,Sustainable Urban Forms,article,0739-456X,Journal of Planning Education and Research,http://readinglists.ucl.ac.uk/items/E37D670B-551F-9D10-691B-A6F49BA52901.html,2F2A7E4B-B152-BF2B-F545-9CA96493F756:Optional,1552-6577,10.1177/0739456X05285119
E3B4EE5F-383F-9584-D4E1-8103D20EFD15,"The Size, Scale, and Shape of Cities",article,0036-8075,Science,http://readinglists.ucl.ac.uk/items/E3B4EE5F-383F-9584-D4E1-8103D20EFD15.html,2F2A7E4B-B152-BF2B-F545-9CA96493F756:Recommended,1095-9203,10.1126/science.1151419
E52CA9B4-F489-3869-565C-AEAADEDAFFA5,"Personal Fabrication: Fab Labs as Platforms for Citizen-Based Innovation, from Microcontrollers to Cities",article,1590-5896,Nexus Network Journal,http://readinglists.ucl.ac.uk/items/E52CA9B4-F489-3869-565C-AEAADEDAFFA5.html,AEDE270D-2CDE-A8DD-D05F-2D85E0F4FEA1:Optional,1522-4600,10.1007/s00004-012-0131-7
E54D7E5A-23C9-9086-4218-2DF75A95F0BC,Modelling spatial point patterns in R,article,,"Case Studies in Spatial Point Pattern Modelling. Lecture Notes in Statistics 185, 23–74",http://readinglists.ucl.ac.uk/items/E54D7E5A-23C9-9086-4218-2DF75A95F0BC.html,F66757BF-E61E-B8BB-95A0-1F25B51E3818,,10.1007/0-387-31144-0
E610EEAD-4E82-4994-B4F6-5C883A275080,Projections,chapter,,International Encyclopedia of Human Geography,http://readinglists.ucl.ac.uk/items/E610EEAD-4E82-4994-B4F6-5C883A275080.html,F66757BF-E61E-B8BB-95A0-1F25B51E3818,,
E79C1837-7922-79E8-CCB8-58F89A69F5D5,Generating cities from the bottom-up: Using complexity theory for effective design,document,,,http://readinglists.ucl.ac.uk/items/E79C1837-7922-79E8-CCB8-58F89A69F5D5.html,2F2A7E4B-B152-BF2B-F545-9CA96493F756:Recommended,,
E8543CA0-0798-6905-6FB1-B78E7B829E3C,PD 8100 – Smart Cities Overview | BSI Group,webpage,,,http://readinglists.ucl.ac.uk/items/E8543CA0-0798-6905-6FB1-B78E7B829E3C.html,AEDE270D-2CDE-A8DD-D05F-2D85E0F4FEA1:Optional,,
E9338E53-69D9-9A8D-8CE4-375A5EEF7017,Desperately Seeking the Infrastructure in IS Research: Conceptualization of 'Digital Convergence' As Co-Evolution of Social and Technical Infrastructures,article,,2010 43rd Hawaii International Conference on System Sciences,http://readinglists.ucl.ac.uk/items/E9338E53-69D9-9A8D-8CE4-375A5EEF7017.html,AEDE270D-2CDE-A8DD-D05F-2D85E0F4FEA1:Optional,,10.1109/HICSS.2010.141
E9681177-3DF3-04B6-FED4-D33668B314A9,"Smart cities, epistemic communities, advocacy coalitions and the `last mile' problem",article,1611-2776,it - Information Technology,http://readinglists.ucl.ac.uk/items/E9681177-3DF3-04B6-FED4-D33668B314A9.html,AEDE270D-2CDE-A8DD-D05F-2D85E0F4FEA1:Recommended,2196-7032,10.1515/itit-2017-0004
E983E97A-91D5-A65D-8F92-C74F9D6A278D,Spatial Point Pattern Analysis and Its Application in Geographical Epidemiology,article,,Transactions of the Institute of British Geographers,http://readinglists.ucl.ac.uk/items/E983E97A-91D5-A65D-8F92-C74F9D6A278D.html,F66757BF-E61E-B8BB-95A0-1F25B51E3818:Recommended,,
E9BFC4C5-CBDC-E4F8-6D30-5EC1925300EA,Smart City Reference Model: Assisting Planners to Conceptualize the Building of Smart City Innovation Ecosystems,article,1868-7865,Journal of the Knowledge Economy,http://readinglists.ucl.ac.uk/items/E9BFC4C5-CBDC-E4F8-6D30-5EC1925300EA.html,AEDE270D-2CDE-A8DD-D05F-2D85E0F4FEA1:Optional,1868-7873,10.1007/s13132-012-0089-4
E9D57664-DC8B-71F2-B611-D2D6A261B00E,The Planner's Triangle Revisited: Sustainability and the Evolution of a Planning Ideal That Can't Stand Still,article,0194-4363,Journal of the American Planning Association,http://readinglists.ucl.ac.uk/items/E9D57664-DC8B-71F2-B611-D2D6A261B00E.html,2F2A7E4B-B152-BF2B-F545-9CA96493F756:Recommended,1939-0130,10.1080/01944363.2016.1214080
EB7E8095-5F94-DA07-E686-9C17AB939645,The ethics of smart cities and urban science,article,1364-503X,"Philosophical Transactions of the Royal Society A: Mathematical, Physical and Engineering Sciences",http://readinglists.ucl.ac.uk/items/EB7E8095-5F94-DA07-E686-9C17AB939645.html,AEDE270D-2CDE-A8DD-D05F-2D85E0F4FEA1:Recommended,1471-2962,10.1098/rsta.2016.0115
EBDBFADD-3335-F43B-FB65-0AC131B33B24,Urban planning and building smart cities based on the Internet of Things using Big Data analytics,article,13891286,Computer Networks,http://readinglists.ucl.ac.uk/items/EBDBFADD-3335-F43B-FB65-0AC131B33B24.html,AEDE270D-2CDE-A8DD-D05F-2D85E0F4FEA1:Optional,,10.1016/j.comnet.2015.12.023
EC88E36F-F4F3-AEF8-75EC-C7B704877AAA,Citizen-centric data services for smarter cities,article,0167739X,Future Generation Computer Systems,http://readinglists.ucl.ac.uk/items/EC88E36F-F4F3-AEF8-75EC-C7B704877AAA.html,AEDE270D-2CDE-A8DD-D05F-2D85E0F4FEA1:Optional,,10.1016/j.future.2016.10.031
EF3D4D03-2D72-308B-79C3-67996101E446,The R software environment in reproducible geoscientific research,article,0096-3941,"Eos, Transactions American Geophysical Union",http://readinglists.ucl.ac.uk/items/EF3D4D03-2D72-308B-79C3-67996101E446.html,F66757BF-E61E-B8BB-95A0-1F25B51E3818,2324-9250,10.1029/2012EO160003
EF875DF4-98B1-A280-CF2B-5EA6AC60CE92,PAS 181 – Smart Cities Framework | BSI Group,webpage,,,http://readinglists.ucl.ac.uk/items/EF875DF4-98B1-A280-CF2B-5EA6AC60CE92.html,AEDE270D-2CDE-A8DD-D05F-2D85E0F4FEA1:Optional,,
F050A486-3AF9-BE73-B77A-4F5FE70FB0CC,The Origins of Scaling in Cities,article,0036-8075,Science,http://readinglists.ucl.ac.uk/items/F050A486-3AF9-BE73-B77A-4F5FE70FB0CC.html,2F2A7E4B-B152-BF2B-F545-9CA96493F756:Optional,1095-9203,10.1126/science.1235823
F0623B98-C98E-3BAC-9D35-E36C45282AD0,Citizen Driven Innovation,document,,,http://readinglists.ucl.ac.uk/items/F0623B98-C98E-3BAC-9D35-E36C45282AD0.html,AEDE270D-2CDE-A8DD-D05F-2D85E0F4FEA1:Optional,,
