reference,title,type,issn,part-of,url,reading-lists,eissn,doi
4E548859-CBE9-A526-FB92-3E64F9A53D61,Think Python – Green Tea Press,webpage,,,http://readinglists.ucl.ac.uk/items/4E548859-CBE9-A526-FB92-3E64F9A53D61.html,14F7EC69-3236-486A-5D3B-01B939E718AE:Recommended,,
4E9686E9-69DE-F484-132A-FC7C1EFF7AF9,Tobler's First Law and Spatial Analysis,article,0004-5608,Annals of the Association of American Geographers,http://readinglists.ucl.ac.uk/items/4E9686E9-69DE-F484-132A-FC7C1EFF7AF9.html,F66757BF-E61E-B8BB-95A0-1F25B51E3818,1467-8306,10.1111/j.1467-8306.2004.09402005.x
4F447CEA-F090-592A-6CD2-ED3F7AAE8C4E,Chapters 1 and 2 of Inventing Future Cities,chapter,,Inventing future cities,http://readinglists.ucl.ac.uk/items/4F447CEA-F090-592A-6CD2-ED3F7AAE8C4E.html,2F2A7E4B-B152-BF2B-F545-9CA96493F756:Recommended,,
4FFBED34-B2BE-7481-750B-274A2EDC7DD3,Dynamic models of segregation,article,0022-250X,The Journal of Mathematical Sociology,http://readinglists.ucl.ac.uk/items/4FFBED34-B2BE-7481-750B-274A2EDC7DD3.html,2F2A7E4B-B152-BF2B-F545-9CA96493F756:Recommended,1545-5874,10.1080/0022250X.1971.9989794
51A64368-6C22-D0AD-E95E-DC7930638672,What is a Forest? On the Vagueness of Certain Geographic Concepts,article,491273,Topoi,http://readinglists.ucl.ac.uk/items/51A64368-6C22-D0AD-E95E-DC7930638672.html,F66757BF-E61E-B8BB-95A0-1F25B51E3818,,10.1023/A:1017965025666
51C94009-D253-2514-8D38-F22F550E385D,The Known Traveller: Unlocking the potential of digital identity for secure and seamless travel,document,,,http://readinglists.ucl.ac.uk/items/51C94009-D253-2514-8D38-F22F550E385D.html,AEDE270D-2CDE-A8DD-D05F-2D85E0F4FEA1:Optional,,
51D5B701-E3F5-5026-22A9-D6ADE1DE20C1,Mastering Shiny,website,,,http://readinglists.ucl.ac.uk/items/51D5B701-E3F5-5026-22A9-D6ADE1DE20C1.html,F66757BF-E61E-B8BB-95A0-1F25B51E3818,,
51F9F269-09FA-CD65-0576-C1EEF2F0D06E,Point pattern analysis using R,chapter,,An introduction to R for spatial analysis and mapping,http://readinglists.ucl.ac.uk/items/51F9F269-09FA-CD65-0576-C1EEF2F0D06E.html,F66757BF-E61E-B8BB-95A0-1F25B51E3818,,
524B63A9-53F5-8076-C542-219770BA1628,"Measuring and modelling segregation – New concepts, new methods and new data",article,2399-8083,Environment and Planning B: Urban Analytics and City Science,http://readinglists.ucl.ac.uk/items/524B63A9-53F5-8076-C542-219770BA1628.html,2F2A7E4B-B152-BF2B-F545-9CA96493F756:Optional,2399-8091,10.1177/2399808318808889
55571464-0CDD-2A15-FE98-7D9A39D31F54,ggplot2,webpage,,,http://readinglists.ucl.ac.uk/items/55571464-0CDD-2A15-FE98-7D9A39D31F54.html,F66757BF-E61E-B8BB-95A0-1F25B51E3818,,
55B693D1-31C8-9D82-D426-B6709A13E25B,Buzz: face-to-face contact and the urban economy,article,1468-2702,Journal of Economic Geography,http://readinglists.ucl.ac.uk/items/55B693D1-31C8-9D82-D426-B6709A13E25B.html,AEDE270D-2CDE-A8DD-D05F-2D85E0F4FEA1:Recommended,1468-2710,10.1093/jnlecg/lbh027
55C9821A-EE9D-2223-3408-009D6A3A63C3,Geo-temporal Twitter demographics,article,1365-8816,International Journal of Geographical Information Science,http://readinglists.ucl.ac.uk/items/55C9821A-EE9D-2223-3408-009D6A3A63C3.html,2F2A7E4B-B152-BF2B-F545-9CA96493F756:Optional,1362-3087,10.1080/13658816.2015.1089441
571AA5A0-6963-EDA5-8202-46AE52A5E564,"Privacy in the Smart City—Applications, Technologies, Challenges, and Solutions",article,,IEEE Communications Surveys &amp; Tutorials,http://readinglists.ucl.ac.uk/items/571AA5A0-6963-EDA5-8202-46AE52A5E564.html,AEDE270D-2CDE-A8DD-D05F-2D85E0F4FEA1:Optional,1553-877X,10.1109/COMST.2017.2748998
58C5D008-9A5B-4744-950C-ACFF2DE2E020,"World Urbanization Prospects: The 2018 Revision, Highlights",document,,,http://readinglists.ucl.ac.uk/items/58C5D008-9A5B-4744-950C-ACFF2DE2E020.html,2F2A7E4B-B152-BF2B-F545-9CA96493F756:Optional,,
58C6FEDB-3E9B-580B-B2CA-09A62A31451C,Using R as a GIS,chapter,,An introduction to R for spatial analysis and mapping,http://readinglists.ucl.ac.uk/items/58C6FEDB-3E9B-580B-B2CA-09A62A31451C.html,F66757BF-E61E-B8BB-95A0-1F25B51E3818,,
58DCE984-5710-0C8C-C681-0E531AB3D7E1,Zipf's Law for Cities: An Explanation,article,0033-5533,The Quarterly Journal of Economics,http://readinglists.ucl.ac.uk/items/58DCE984-5710-0C8C-C681-0E531AB3D7E1.html,2F2A7E4B-B152-BF2B-F545-9CA96493F756:Optional,1531-4650,10.1162/003355399556133
58E9CB34-27C1-FCBF-59E5-51333B778700,PAS 180 – Smart Cities Terminology | BSI Group,webpage,,,http://readinglists.ucl.ac.uk/items/58E9CB34-27C1-FCBF-59E5-51333B778700.html,AEDE270D-2CDE-A8DD-D05F-2D85E0F4FEA1:Optional,,
59C5FF24-D5FC-5386-8987-85ECCF125468,"Geography and computers: Past, present, and future",article,,Geography Compass,http://readinglists.ucl.ac.uk/items/59C5FF24-D5FC-5386-8987-85ECCF125468.html,14F7EC69-3236-486A-5D3B-01B939E718AE:Essential,,10.1111/gec3.12403
5A4674AB-47F0-23A7-9A1D-58C6DA270737,Propagation of errors in spatial modelling with GIS,article,0269-3798,International journal of geographical information systems,http://readinglists.ucl.ac.uk/items/5A4674AB-47F0-23A7-9A1D-58C6DA270737.html,F66757BF-E61E-B8BB-95A0-1F25B51E3818,,10.1080/02693798908941518
5AB3FAE0-0902-46C0-0F20-69C9CA1AD526,The Triple-Helix Model of Smart Cities: A Neo-Evolutionary Perspective,article,1063-0732,Journal of Urban Technology,http://readinglists.ucl.ac.uk/items/5AB3FAE0-0902-46C0-0F20-69C9CA1AD526.html,AEDE270D-2CDE-A8DD-D05F-2D85E0F4FEA1:Optional,1466-1853,10.1080/10630732.2011.601111
5D050F9F-6DD2-6E95-BD5D-A88DBE4646DC,Open Data Study,webpage,,,http://readinglists.ucl.ac.uk/items/5D050F9F-6DD2-6E95-BD5D-A88DBE4646DC.html,AEDE270D-2CDE-A8DD-D05F-2D85E0F4FEA1:Optional,,
5ECF31A7-8BFA-04DA-E51E-08753AC80033,"Benefits, Adoption Barriers and Myths of Open Data and Open Government",article,1058-0530,Information Systems Management,http://readinglists.ucl.ac.uk/items/5ECF31A7-8BFA-04DA-E51E-08753AC80033.html,AEDE270D-2CDE-A8DD-D05F-2D85E0F4FEA1:Optional,1934-8703,10.1080/10580530.2012.716740
5F381FD9-F138-BA23-D6D1-E223409170C0,GIScience and Systems,chapter,,International Encyclopedia of Human Geography,http://readinglists.ucl.ac.uk/items/5F381FD9-F138-BA23-D6D1-E223409170C0.html,F66757BF-E61E-B8BB-95A0-1F25B51E3818,,
5F43018C-E3EB-6163-21B5-F669261B6941,Chapter 4: What Gets Counted Counts,chapter,,Data Feminism,http://readinglists.ucl.ac.uk/items/5F43018C-E3EB-6163-21B5-F669261B6941.html,14F7EC69-3236-486A-5D3B-01B939E718AE:Essential,,
5F714CD9-5AAD-1E55-169C-98436C4BBBFC,Scaling Laws and Urban Systems,article,,,http://readinglists.ucl.ac.uk/items/5F714CD9-5AAD-1E55-169C-98436C4BBBFC.html,2F2A7E4B-B152-BF2B-F545-9CA96493F756:Recommended,,
5F7A5F7C-1A6D-8DCD-EA57-74DA4459AEBA,Urban Policy Mobilities and Global Circuits of Knowledge: Toward a Research Agenda,article,0004-5608,Annals of the Association of American Geographers,http://readinglists.ucl.ac.uk/items/5F7A5F7C-1A6D-8DCD-EA57-74DA4459AEBA.html,AEDE270D-2CDE-A8DD-D05F-2D85E0F4FEA1:Optional,1467-8306,10.1080/00045608.2010.520219
5FAC76C1-B9D6-6407-4FDC-6399BD5B8EA7,Developing a critical understanding of smart urbanism?,article,0042-0980,Urban Studies,http://readinglists.ucl.ac.uk/items/5FAC76C1-B9D6-6407-4FDC-6399BD5B8EA7.html,AEDE270D-2CDE-A8DD-D05F-2D85E0F4FEA1:Optional,1360-063X,10.1177/0042098015577319
6059320D-28FA-107F-5B6E-6672659DF1F1,Broadband speed map reveals Britain’s new digital divide,webpage,,,http://readinglists.ucl.ac.uk/items/6059320D-28FA-107F-5B6E-6672659DF1F1.html,AEDE270D-2CDE-A8DD-D05F-2D85E0F4FEA1:Optional,,
6076D2A9-6D68-2F5E-B8A6-E23F98E16B67,Estimation of land surface temperature–vegetation abundance relationship for urban heat island studies,article,116911,Remote Sensing of Environment,http://readinglists.ucl.ac.uk/items/6076D2A9-6D68-2F5E-B8A6-E23F98E16B67.html,F66757BF-E61E-B8BB-95A0-1F25B51E3818,,10.1016/j.rse.2003.11.005
6109A958-8103-6C2A-5ABA-3297411BBCF0,The spatial pattern of premature mortality in Hong Kong: How does it relate to public housing?,article,0042-0980,Urban Studies,http://readinglists.ucl.ac.uk/items/6109A958-8103-6C2A-5ABA-3297411BBCF0.html,2F2A7E4B-B152-BF2B-F545-9CA96493F756:Optional,1360-063X,10.1177/0042098015620341
617701B1-8151-66FD-9F81-EB5DABBF15C2,Diverse cities or the systematic paradox of Urban Scaling Laws,article,01989715,"Computers, Environment and Urban Systems",http://readinglists.ucl.ac.uk/items/617701B1-8151-66FD-9F81-EB5DABBF15C2.html,2F2A7E4B-B152-BF2B-F545-9CA96493F756:Optional,,10.1016/j.compenvurbsys.2016.04.006
61D5C1FA-C0EF-4E45-CCBF-894125C21225,Will the real smart city please stand up?,article,1360-4813,City,http://readinglists.ucl.ac.uk/items/61D5C1FA-C0EF-4E45-CCBF-894125C21225.html,AEDE270D-2CDE-A8DD-D05F-2D85E0F4FEA1:Recommended,1470-3629,10.1080/13604810802479126
6212EEF9-66B0-AFC2-DFB9-21364B4A770F,"The magical number seven, plus or minus two: some limits on our capacity for processing information.",article,0033-295X,Psychological Review,http://readinglists.ucl.ac.uk/items/6212EEF9-66B0-AFC2-DFB9-21364B4A770F.html,47B7C011-69AE-E2E9-C205-CEED361CD0EA,,
64140F08-3E7A-DBE2-D338-94196C2CC31B,"Applied spatial data analysis with R, chapter 3",chapter,,,http://readinglists.ucl.ac.uk/items/64140F08-3E7A-DBE2-D338-94196C2CC31B.html,F66757BF-E61E-B8BB-95A0-1F25B51E3818,,
65828848-A6FD-9675-EEEC-537B906615E1,Organicity Playbook,document,,,http://readinglists.ucl.ac.uk/items/65828848-A6FD-9675-EEEC-537B906615E1.html,AEDE270D-2CDE-A8DD-D05F-2D85E0F4FEA1:Optional,,
66211785-4219-DDDE-5F4A-673E2082716D,Business Strategy: IDC Government Insights' Smart City Maturity Model —Assessment and Action on the Path to Maturity,document,,,http://readinglists.ucl.ac.uk/items/66211785-4219-DDDE-5F4A-673E2082716D.html,AEDE270D-2CDE-A8DD-D05F-2D85E0F4FEA1:Optional,,
66B9426A-C6F8-C66A-460D-14B4D4A4CD28,Counterurbanization in South Africa: Measuring migration significance,article,,Regional Science Policy &amp; Practice,http://readinglists.ucl.ac.uk/items/66B9426A-C6F8-C66A-460D-14B4D4A4CD28.html,2F2A7E4B-B152-BF2B-F545-9CA96493F756:Optional,,10.1111/rsp3.12105
673913B2-7A88-B764-C84F-B455CDBC1E51,Chapter 6: The Numbers Don’t Speak for Themselves,chapter,,Data Feminism,http://readinglists.ucl.ac.uk/items/673913B2-7A88-B764-C84F-B455CDBC1E51.html,14F7EC69-3236-486A-5D3B-01B939E718AE:Essential,,
68F9DF4E-D73F-F0A9-5DEC-329B835E0C1D,Embodiment: a conceptual glossary for epidemiology,article,0143-005X,Journal of Epidemiology &amp; Community Health,http://readinglists.ucl.ac.uk/items/68F9DF4E-D73F-F0A9-5DEC-329B835E0C1D.html,2F2A7E4B-B152-BF2B-F545-9CA96493F756:Optional,,10.1136/jech.2004.024562
68FFD69F-8BC6-5BB1-A913-6F8DE41BD39D,R Markdown: The Definitive Guide,webpage,,,http://readinglists.ucl.ac.uk/items/68FFD69F-8BC6-5BB1-A913-6F8DE41BD39D.html,F66757BF-E61E-B8BB-95A0-1F25B51E3818,,
6B1390B3-7B49-0E84-5891-804FBF9BC673,A survival guide to Landsat preprocessing,article,,Ecology,http://readinglists.ucl.ac.uk/items/6B1390B3-7B49-0E84-5891-804FBF9BC673.html,F66757BF-E61E-B8BB-95A0-1F25B51E3818,,10.1002/ecy.1730
6D7ABDFA-B906-16F9-9199-B34FC2D4F851,"Geodemographics, Software and Class",article,0038-0385,Sociology,http://readinglists.ucl.ac.uk/items/6D7ABDFA-B906-16F9-9199-B34FC2D4F851.html,2F2A7E4B-B152-BF2B-F545-9CA96493F756:Recommended,1469-8684,10.1177/0038038506067507
6E80194F-9763-AA53-3FB0-CFDBB2589548,"Cities as Complex Systems: Scaling, Interaction, Networks, Dynamics and Urban Morphologies",chapter,,Encyclopedia of Complexity and Systems Science,http://readinglists.ucl.ac.uk/items/6E80194F-9763-AA53-3FB0-CFDBB2589548.html,2F2A7E4B-B152-BF2B-F545-9CA96493F756:Optional,,10.1007/978-0-387-30440-3_69
6F8803CB-097C-3C39-A2C7-34E0801F0FE4,Point Pattern Analysis,article,,Geographic Information Science &amp; Technology Body of Knowledge,http://readinglists.ucl.ac.uk/items/6F8803CB-097C-3C39-A2C7-34E0801F0FE4.html,14F7EC69-3236-486A-5D3B-01B939E718AE:Optional,25772848,10.22224/gistbok/2020.1.13
6FCBE35F-DED7-65EB-2AC7-B87ECA7D2BFB,"Mine your data: open data, digital strategies and entrepreneurial governance by code",article,0272-3638,Urban Geography,http://readinglists.ucl.ac.uk/items/6FCBE35F-DED7-65EB-2AC7-B87ECA7D2BFB.html,AEDE270D-2CDE-A8DD-D05F-2D85E0F4FEA1:Recommended,1938-2847,10.1080/02723638.2016.1139876
702B0F1B-E13F-EE73-F341-69F6374C79F2,"Mike Batty's Lectures on Models, Complexity, and Smart Cities at various places",website,,,http://readinglists.ucl.ac.uk/items/702B0F1B-E13F-EE73-F341-69F6374C79F2.html,2F2A7E4B-B152-BF2B-F545-9CA96493F756:Optional,,
71EB071B-9646-958B-64FC-90FA9F273F7D,Programming Environments: Environmentality and Citizen Sensing in the Smart City,article,0263-7758,Environment and Planning D: Society and Space,http://readinglists.ucl.ac.uk/items/71EB071B-9646-958B-64FC-90FA9F273F7D.html,AEDE270D-2CDE-A8DD-D05F-2D85E0F4FEA1:Optional,1472-3433,10.1068/d16812
721066DC-D2C2-D9EE-7E0F-9CD518A678E3,A Chronicle of Scientific Planning: The Anglo-American Modeling Experience,article,0194-4363,Journal of the American Planning Association,http://readinglists.ucl.ac.uk/items/721066DC-D2C2-D9EE-7E0F-9CD518A678E3.html,A6D7ED9B-ABF0-F08D-060D-726808C7AF2D,1939-0130,10.1080/01944369408975546
724415BC-4EE9-F7AA-4270-F7DD5D5D3239,Human Ecology,article,,American Journal of Sociology,http://readinglists.ucl.ac.uk/items/724415BC-4EE9-F7AA-4270-F7DD5D5D3239.html,2F2A7E4B-B152-BF2B-F545-9CA96493F756:Recommended,,
749547C3-F59C-5CE9-E3E9-22CEB6D80541,There is More than a Power Law in Zipf,article,,Scientific Reports,http://readinglists.ucl.ac.uk/items/749547C3-F59C-5CE9-E3E9-22CEB6D80541.html,2F2A7E4B-B152-BF2B-F545-9CA96493F756:Optional,2045-2322,10.1038/srep00812
75D1E768-C6E5-2374-D211-BF57AC3A820A,Spatial Autocorrelation and the Quantitative Revolution,article,,Geographical Analysis,http://readinglists.ucl.ac.uk/items/75D1E768-C6E5-2374-D211-BF57AC3A820A.html,F66757BF-E61E-B8BB-95A0-1F25B51E3818,,10.1111/j.1538-4632.2009.00763.x
793B834F-5F53-07AD-C380-467DFAAC6DA8,Doubt and the Algorithm: On the Partial Accounts of Machine Learning,article,0263-2764,"Theory, Culture &amp; Society",http://readinglists.ucl.ac.uk/items/793B834F-5F53-07AD-C380-467DFAAC6DA8.html,14F7EC69-3236-486A-5D3B-01B939E718AE:Essential,1460-3616,10.1177/0263276419851846
797B15E8-CD0F-9DF7-796C-0256104949AF,Introduction to Python with Microsoft Azure Notebooks,webpage,,,http://readinglists.ucl.ac.uk/items/797B15E8-CD0F-9DF7-796C-0256104949AF.html,14F7EC69-3236-486A-5D3B-01B939E718AE:Optional,,
7A27D8E4-3D84-6755-116B-117DF60C9C9F,Transforming our world: The 2030 agenda for sustainable development,document,,,http://readinglists.ucl.ac.uk/items/7A27D8E4-3D84-6755-116B-117DF60C9C9F.html,2F2A7E4B-B152-BF2B-F545-9CA96493F756:Optional,,
7A6FD2F7-7595-9C0F-84F9-21B9B04E1E41,SMM: A Maturity Model of Smart Cities Based on Sustainability Indicators of the ISO 37122,article,23496495,International Journal of Advanced Engineering Research and Science,http://readinglists.ucl.ac.uk/items/7A6FD2F7-7595-9C0F-84F9-21B9B04E1E41.html,AEDE270D-2CDE-A8DD-D05F-2D85E0F4FEA1:Optional,24561908,10.22161/ijaers.6.2.2
7AA480A7-14EC-3EC2-EC7C-3939ABE4F3DF,Geographies of policy knowledge: The state and corporate dimensions of contemporary policy mobilities,article,738793,Cities,http://readinglists.ucl.ac.uk/items/7AA480A7-14EC-3EC2-EC7C-3939ABE4F3DF.html,AEDE270D-2CDE-A8DD-D05F-2D85E0F4FEA1:Optional,,10.1016/j.cities.2017.01.001
7AA9D6A8-7BE7-341D-BB3C-319E94D54ECE,The London Output Area Classification (LOAC),document,,,http://readinglists.ucl.ac.uk/items/7AA9D6A8-7BE7-341D-BB3C-319E94D54ECE.html,2F2A7E4B-B152-BF2B-F545-9CA96493F756:Optional,,
7DD5B416-D17C-AFE9-A3E2-CE437E8935ED,"Social practice, plural lifestyles and health inequalities in the United Kingdom",article,,Sociology of Health &amp; Illness,http://readinglists.ucl.ac.uk/items/7DD5B416-D17C-AFE9-A3E2-CE437E8935ED.html,2F2A7E4B-B152-BF2B-F545-9CA96493F756:Optional,,10.1111/1467-9566.12780
8161203C-AAB2-C98B-98AE-C2E66B9A48F2,Critical Truths About Power Laws,article,0036-8075,Science,http://readinglists.ucl.ac.uk/items/8161203C-AAB2-C98B-98AE-C2E66B9A48F2.html,2F2A7E4B-B152-BF2B-F545-9CA96493F756:Optional,1095-9203,10.1126/science.1216142
834576DA-B135-9600-C7BD-8260656D4E14,How to write a paper for publication,article,14439506,"Heart, Lung and Circulation",http://readinglists.ucl.ac.uk/items/834576DA-B135-9600-C7BD-8260656D4E14.html,F66757BF-E61E-B8BB-95A0-1F25B51E3818,,10.1046/j.1444-2892.2000.00031.x
839871C4-A74B-B01B-8198-458FF1193F2B,Geographically Weighted Regression,chapter,,International Encyclopedia of Human Geography,http://readinglists.ucl.ac.uk/items/839871C4-A74B-B01B-8198-458FF1193F2B.html,F66757BF-E61E-B8BB-95A0-1F25B51E3818,,
86AECFC1-D548-B113-6F22-256583B207B2,Local Indicators of Spatial Association-LISA,article,,Geographical Analysis,http://readinglists.ucl.ac.uk/items/86AECFC1-D548-B113-6F22-256583B207B2.html,F66757BF-E61E-B8BB-95A0-1F25B51E3818,,10.1111/j.1538-4632.1995.tb00338.x
881EA686-47F1-30B9-45FB-4E5A1E9422F0,"Growth, innovation, scaling, and the pace of life in cities",article,0027-8424,Proceedings of the National Academy of Sciences,http://readinglists.ucl.ac.uk/items/881EA686-47F1-30B9-45FB-4E5A1E9422F0.html,2F2A7E4B-B152-BF2B-F545-9CA96493F756:Optional,1091-6490,10.1073/pnas.0610172104
89F4BE99-2B48-20DF-275C-E74DC4672670,New Approaches for Calculating Moran’s Index of Spatial Autocorrelation,article,,PLoS ONE,http://readinglists.ucl.ac.uk/items/89F4BE99-2B48-20DF-275C-E74DC4672670.html,F66757BF-E61E-B8BB-95A0-1F25B51E3818,1932-6203,10.1371/journal.pone.0068336
8A39F35B-1D4F-F980-15CB-4E0513FAF458,"Boltzmann, Lotka and Volterra and spatial structural evolution: an integrated methodology for some dynamical systems",article,1742-5689,Journal of The Royal Society Interface,http://readinglists.ucl.ac.uk/items/8A39F35B-1D4F-F980-15CB-4E0513FAF458.html,A6D7ED9B-ABF0-F08D-060D-726808C7AF2D,1742-5662,10.1098/rsif.2007.1288
8B4D1104-7774-7BA1-D6AC-388ABC4A26D3,Complexity Explorer: Santa Fe Institute,website,,,http://readinglists.ucl.ac.uk/items/8B4D1104-7774-7BA1-D6AC-388ABC4A26D3.html,2F2A7E4B-B152-BF2B-F545-9CA96493F756:Optional,,
8B598928-6213-17C0-15E3-124F09E84DB2,Cities and the Creative Class,article,1535-6841,City and Community,http://readinglists.ucl.ac.uk/items/8B598928-6213-17C0-15E3-124F09E84DB2.html,2F2A7E4B-B152-BF2B-F545-9CA96493F756:Optional,1540-6040,10.1111/1540-6040.00034
8B762068-35E0-F280-2110-0FD7B35A80A4,Measuring the Information Society Report 2017,document,,,http://readinglists.ucl.ac.uk/items/8B762068-35E0-F280-2110-0FD7B35A80A4.html,AEDE270D-2CDE-A8DD-D05F-2D85E0F4FEA1:Optional,,
8BA85FC6-AAFD-F5FD-B519-B927E55332A3,State of European Cities Report: Adding value to the European Urban Audit,document,,,http://readinglists.ucl.ac.uk/items/8BA85FC6-AAFD-F5FD-B519-B927E55332A3.html,2F2A7E4B-B152-BF2B-F545-9CA96493F756:Optional,,
8BC25916-E1CC-B625-43F9-B1B8D43E4866,The English Indices of Deprivation 2015: Technical Report,document,,,http://readinglists.ucl.ac.uk/items/8BC25916-E1CC-B625-43F9-B1B8D43E4866.html,2F2A7E4B-B152-BF2B-F545-9CA96493F756:Optional,,
8C1A757C-AC9E-22B5-218E-2F3A2F18B98D,Adam's RPubs website,webpage,,,http://readinglists.ucl.ac.uk/items/8C1A757C-AC9E-22B5-218E-2F3A2F18B98D.html,F66757BF-E61E-B8BB-95A0-1F25B51E3818,,
8DE76B5A-8450-6684-3913-039948FECF53,Owning the city: New media and citizen engagement in urban design,article,13960466,First Monday,http://readinglists.ucl.ac.uk/items/8DE76B5A-8450-6684-3913-039948FECF53.html,AEDE270D-2CDE-A8DD-D05F-2D85E0F4FEA1:Optional,13960466,
8E855EF4-1AFA-05AD-ECFC-A63CE019ED22,Building regression models: the importance of graphics,article,0309-8265,Journal of Geography in Higher Education,http://readinglists.ucl.ac.uk/items/8E855EF4-1AFA-05AD-ECFC-A63CE019ED22.html,F66757BF-E61E-B8BB-95A0-1F25B51E3818,1466-1845,10.1080/03098268908709055
8EF69024-6448-2160-2304-4833513A3A8B,A Final Tale or You Can Prove Anything with Figures,document,,,http://readinglists.ucl.ac.uk/items/8EF69024-6448-2160-2304-4833513A3A8B.html,14F7EC69-3236-486A-5D3B-01B939E718AE:Essential,,
8EF6B481-A244-AB95-26F0-05E14772F5B8,"Chapter 3: On Rational, Scientific, Objective Viewpoints from Mythical, Imaginary, Impossible Standpoints",chapter,,Data Feminism,http://readinglists.ucl.ac.uk/items/8EF6B481-A244-AB95-26F0-05E14772F5B8.html,14F7EC69-3236-486A-5D3B-01B939E718AE:Essential,,
8F96FC1D-C528-8430-E44C-FBFF12EBED27,Algorithm for Automated Mapping of Land Surface Temperature Using LANDSAT 8 Satellite Data,article,1687-725X,Journal of Sensors,http://readinglists.ucl.ac.uk/items/8F96FC1D-C528-8430-E44C-FBFF12EBED27.html,F66757BF-E61E-B8BB-95A0-1F25B51E3818,1687-7268,10.1155/2016/1480307
9096CC73-7039-AA1D-3800-AADDAF139615,The political topology of urban uprisings,article,0272-3638,Urban Geography,http://readinglists.ucl.ac.uk/items/9096CC73-7039-AA1D-3800-AADDAF139615.html,2F2A7E4B-B152-BF2B-F545-9CA96493F756:Optional,1938-2847,10.1080/02723638.2016.1168568
90FF0361-647C-BB08-8932-EA9201B698C8,ISO and smart cities,document,,,http://readinglists.ucl.ac.uk/items/90FF0361-647C-BB08-8932-EA9201B698C8.html,AEDE270D-2CDE-A8DD-D05F-2D85E0F4FEA1:Optional,,
9231B84B-A472-B6EB-EA86-A3016B4F5BD0,Smart cities and attracting knowledge workers: Which cities attract highly-educated workers in the 21st century?,article,,Papers in Regional Science,http://readinglists.ucl.ac.uk/items/9231B84B-A472-B6EB-EA86-A3016B4F5BD0.html,AEDE270D-2CDE-A8DD-D05F-2D85E0F4FEA1:Optional,,10.1111/pirs.12163
929CBDF1-8586-0C62-3E0C-8402A64AEA39,Alex Singleton's RPubs website,webpage,,,http://readinglists.ucl.ac.uk/items/929CBDF1-8586-0C62-3E0C-8402A64AEA39.html,F66757BF-E61E-B8BB-95A0-1F25B51E3818,,
93D5F8A2-9B14-B598-D861-837BBA8B4153,IESE Cities in Motion Index 2018,document,,,http://readinglists.ucl.ac.uk/items/93D5F8A2-9B14-B598-D861-837BBA8B4153.html,AEDE270D-2CDE-A8DD-D05F-2D85E0F4FEA1:Optional,,
9401B986-5D0E-7EC8-7C82-C6B414345624,Quantitative methods III: Strength in numbers?,article,0309-1325,Progress in Human Geography,http://readinglists.ucl.ac.uk/items/9401B986-5D0E-7EC8-7C82-C6B414345624.html,14F7EC69-3236-486A-5D3B-01B939E718AE:Essential,1477-0288,10.1177/03091325231210512
944AF5FF-C6B5-62DF-8BC7-05A5865F7921,Chapter 6 (Power and urban segregation) / Chapter 7 (Power and land markets) / Chapter 8 (Segregation and urban economies),chapter,,Building the inclusive city: theory and practice for confronting urban segregation,http://readinglists.ucl.ac.uk/items/944AF5FF-C6B5-62DF-8BC7-05A5865F7921.html,2F2A7E4B-B152-BF2B-F545-9CA96493F756:Essential,,
95EA91A6-9C3B-0C06-3302-24C37E65CE25,Gis methods in time‐geographic research: geocomputation and geovisualization of human activity patterns,article,0435-3684,"Geografiska Annaler: Series B, Human Geography",http://readinglists.ucl.ac.uk/items/95EA91A6-9C3B-0C06-3302-24C37E65CE25.html,2F2A7E4B-B152-BF2B-F545-9CA96493F756:Optional,1468-0467,10.1111/j.0435-3684.2004.00167.x
96F388E6-6439-3119-F855-F95D7481AAB8,Quantitative geography III: Future challenges and challenging futures,article,0309-1325,Progress in Human Geography,http://readinglists.ucl.ac.uk/items/96F388E6-6439-3119-F855-F95D7481AAB8.html,14F7EC69-3236-486A-5D3B-01B939E718AE:Essential,1477-0288,10.1177/0309132520924722
975716C4-FE71-F390-A324-7B7CCF869590,Generalization,chapter,,International Encyclopedia of Human Geography,http://readinglists.ucl.ac.uk/items/975716C4-FE71-F390-A324-7B7CCF869590.html,F66757BF-E61E-B8BB-95A0-1F25B51E3818,,
98403D6D-C667-E812-18FD-0412D2BF37FD,Agenda 21,document,,,http://readinglists.ucl.ac.uk/items/98403D6D-C667-E812-18FD-0412D2BF37FD.html,2F2A7E4B-B152-BF2B-F545-9CA96493F756:Optional,,
993B1D1A-DEF6-03F8-D22D-860E63F0ABCB,Smartmentality: The Smart City as Disciplinary Strategy,article,0042-0980,Urban Studies,http://readinglists.ucl.ac.uk/items/993B1D1A-DEF6-03F8-D22D-860E63F0ABCB.html,AEDE270D-2CDE-A8DD-D05F-2D85E0F4FEA1:Optional,1360-063X,10.1177/0042098013494427
9B005C72-EDCB-5E27-43AE-8B4A6F36DFBA,UrbanSim: Modelling Urban Development for Land Use,article,1939-0130,Journal of the American Planning Association,http://readinglists.ucl.ac.uk/items/9B005C72-EDCB-5E27-43AE-8B4A6F36DFBA.html,A6D7ED9B-ABF0-F08D-060D-726808C7AF2D,,10.1080/01944360208976274
9BE8F165-C845-3C79-50B4-EC8BDFC176A6,Data-driven geography,article,0343-2521,GeoJournal,http://readinglists.ucl.ac.uk/items/9BE8F165-C845-3C79-50B4-EC8BDFC176A6.html,14F7EC69-3236-486A-5D3B-01B939E718AE:Essential,1572-9893,10.1007/s10708-014-9602-6
9C9634A7-535D-74A2-629A-2A9C07FFBBC6,Rethinking 'distance' in New York City,webpage,,,http://readinglists.ucl.ac.uk/items/9C9634A7-535D-74A2-629A-2A9C07FFBBC6.html,14F7EC69-3236-486A-5D3B-01B939E718AE:Recommended,,
9E146C9E-B2AA-6BA4-D59E-7398B9D03E24,The City as Assemblage: Dwelling and Urban Space,article,0263-7758,Environment and Planning D: Society and Space,http://readinglists.ucl.ac.uk/items/9E146C9E-B2AA-6BA4-D59E-7398B9D03E24.html,2F2A7E4B-B152-BF2B-F545-9CA96493F756:Optional,1472-3433,10.1068/d4710
9FCB97BE-7B81-E877-729D-29246AFF4D93,UK Smart Cities Index Assessment of Strategy and Execution of the UK’s Leading Smart Cities,document,,,http://readinglists.ucl.ac.uk/items/9FCB97BE-7B81-E877-729D-29246AFF4D93.html,AEDE270D-2CDE-A8DD-D05F-2D85E0F4FEA1:Optional,,
A0BA9522-407D-068B-9777-8E68E60E1305,A General Model for the Origin of Allometric Scaling Laws in Biology,article,00368075,Science,http://readinglists.ucl.ac.uk/items/A0BA9522-407D-068B-9777-8E68E60E1305.html,2F2A7E4B-B152-BF2B-F545-9CA96493F756:Optional,10959203,10.1126/science.276.5309.122
A25CC4FF-1AF6-D7BF-A76A-80114392C6A3,The Value of the EU Public Domain,webpage,,,http://readinglists.ucl.ac.uk/items/A25CC4FF-1AF6-D7BF-A76A-80114392C6A3.html,AEDE270D-2CDE-A8DD-D05F-2D85E0F4FEA1:Optional,,10.17863/CAM.1051
A2A4A239-9386-05A3-40FA-D14A3E960866,Emergence of Scaling in Random Networks,article,00368075,Science,http://readinglists.ucl.ac.uk/items/A2A4A239-9386-05A3-40FA-D14A3E960866.html,A6D7ED9B-ABF0-F08D-060D-726808C7AF2D,10959203,10.1126/science.286.5439.509
